{
    "id": "6e591250-1674-11ea-ad2e-b992867d06d8",
    "name": "Semiconduct 2500",
    "location": {
        "latitude": 52.5297268,
        "longitude": 13.400391
    },
    "payment": {
        "upfront": 0,
        "afterProcessing": 0,
        "invoice": 0
    },
    "schema": {
        "input": "./env/schema/input.json",
        "output": "./env/schema/output.json"
    },
    "apikey": "365ce7a2f7ab4e4598cd9626e2b0a833",
    "privKey": "./env/key_world.js",
    "mode": 1,
    "apiDomain": "127.0.0.1",
    "port": 3003,
    "info": {
        "description": "./env/description/worker.md",
        "tags": [
            "image processing"
        ],
        "input": {
            "description": "./env/description/input.md",
            "tags": [
                "h"
            ]
        },
        "output": {
            "description": "./env/description/output.md",
            "tags": [
                ""
            ]
        }
    }
}